{
  "schema_version": 1,
  "scenario_id": "digging-persistence-v1",
  "title": "Persistent digging authorizes one mock interruption",
  "description": "High DIGGING probability is paired with sustained soil overlap and local motion for 1.2 seconds. This is the positive counterpart to ordinary paw-motion hard negatives.",
  "requirement_ids": ["REQ-DIGGING-PERSISTENCE", "REQ-SOIL-AND-MOTION", "REQ-ONE-ACTION-PER-INCIDENT"],
  "tags": ["positive", "digging", "persistence", "mock-actuator"],
  "config_ref": "../config/simulation-safe.example.json",
  "initial_conditions": {
    "clock_ms": 0,
    "policy_state": "DISARMED",
    "armed": false,
    "camera_status": "CONNECTED",
    "actuator_status": "READY",
    "command_id_seed": 1300
  },
  "actuator_script": {
    "default_response": "ACK",
    "ack_delay_ms": 20,
    "deduplicate_command_ids": true,
    "overrides": []
  },
  "timeline": [
    {"event_id": "arm", "at_ms": 0, "sequence": 0, "type": "CONTROL", "operation": "ARM"},
    {
      "event_id": "digging-series",
      "at_ms": 100,
      "sequence": 0,
      "type": "OBSERVATION_SERIES",
      "interval_ms": 400,
      "count": 4,
      "capture_offset_ms": 0,
      "id_prefix": "digging",
      "template": {
        "camera_id": "camera-1",
        "tracks": [
          {
            "track_id": "cat-a",
            "class": "CAT",
            "detection_confidence": 0.98,
            "track_quality": 0.96,
            "initial_track_age_ms": 1000,
            "ambiguous": false,
            "bbox": {"x": 0.36, "y": 0.43, "width": 0.38, "height": 0.42},
            "zone_id": "pot-1-approach",
            "behavior": {
              "label": "DIGGING",
              "raw_label": "DIGGING",
              "scores": {"CLEAR": 0.02, "EATING": 0.01, "DIGGING": 0.94, "UNKNOWN": 0.03},
              "model_id": "scripted-behavior-v1"
            },
            "region_evidence": {
              "approach_overlap": 0.94,
              "foliage_overlap": 0.08,
              "soil_overlap": 0.52,
              "motion_score": 0.83
            },
            "aim_preset_id": "pot-1-safe-nearby",
            "no_fire_intersection": false
          }
        ]
      }
    },
    {"event_id": "settle-acks", "at_ms": 1600, "sequence": 0, "type": "TICK"}
  ],
  "expectations": {
    "explanation": "The soil and motion gates support the temporal classification. One and only one mock burst follows the preset ACK.",
    "final_state": "COOLDOWN",
    "exact_counts": {
      "ready_transitions": 1,
      "would_burst_decisions": 1,
      "burst_commands_issued": 1,
      "burst_commands_acked": 1,
      "physical_bursts": 0,
      "automatic_retries": 0,
      "duplicate_commands_suppressed": 0,
      "fault_transitions": 0
    },
    "required_states": ["MONITORING", "TRACKING", "CONFIRMING", "AIMING", "READY", "BURST", "COOLDOWN"],
    "forbidden_states": ["FAULT"],
    "required_reason_codes": ["DIGGING_CONFIRMED", "COMMAND_ACKNOWLEDGED"],
    "forbidden_commands": [],
    "expected_action_sequence": [
      {"command": "GOTO_PRESET", "target": "pot-1-safe-nearby", "result": "ACK"},
      {"command": "BURST", "result": "ACK"}
    ],
    "invariants": ["STARTS_DISARMED", "NO_PHYSICAL_EFFECTS", "ONE_BURST_PER_INCIDENT", "ACTIONS_AUDITED", "DETERMINISTIC_REPLAY"]
  }
}
