{
  "schema_version": 1,
  "scenario_id": "multiple-cats-v1",
  "title": "Multiple visible cats block action",
  "description": "Two unambiguous cat tracks are visible while one appears to eat. The MVP cannot safely associate an interruption path in a multi-cat scene, so it must hold.",
  "requirement_ids": ["REQ-MULTIPLE-CATS-BLOCK-ACTION", "REQ-MVP-AMBIGUITY-HOLD"],
  "tags": ["safety", "multiple-cats", "ambiguity"],
  "config_ref": "../config/simulation-safe.example.json",
  "initial_conditions": {
    "clock_ms": 0,
    "policy_state": "DISARMED",
    "armed": false,
    "camera_status": "CONNECTED",
    "actuator_status": "READY",
    "command_id_seed": 1500
  },
  "actuator_script": {
    "default_response": "ACK",
    "ack_delay_ms": 20,
    "deduplicate_command_ids": true,
    "overrides": []
  },
  "timeline": [
    {"event_id": "arm", "at_ms": 0, "sequence": 0, "type": "CONTROL", "operation": "ARM"},
    {
      "event_id": "two-cat-series",
      "at_ms": 100,
      "sequence": 0,
      "type": "OBSERVATION_SERIES",
      "interval_ms": 400,
      "count": 5,
      "capture_offset_ms": 0,
      "id_prefix": "two-cats",
      "template": {
        "camera_id": "camera-1",
        "tracks": [
          {
            "track_id": "cat-a",
            "class": "CAT",
            "detection_confidence": 0.97,
            "track_quality": 0.95,
            "initial_track_age_ms": 900,
            "ambiguous": false,
            "bbox": {"x": 0.36, "y": 0.28, "width": 0.3, "height": 0.44},
            "zone_id": "pot-1-approach",
            "behavior": {
              "label": "EATING",
              "raw_label": "EATING",
              "scores": {"CLEAR": 0.02, "EATING": 0.94, "DIGGING": 0.01, "UNKNOWN": 0.03},
              "model_id": "scripted-behavior-v1"
            },
            "region_evidence": {
              "approach_overlap": 0.9,
              "foliage_overlap": 0.59,
              "soil_overlap": 0.04,
              "motion_score": 0.4
            },
            "aim_preset_id": "pot-1-safe-nearby",
            "no_fire_intersection": false
          },
          {
            "track_id": "cat-b",
            "class": "CAT",
            "detection_confidence": 0.96,
            "track_quality": 0.92,
            "initial_track_age_ms": 800,
            "ambiguous": false,
            "bbox": {"x": 0.62, "y": 0.5, "width": 0.3, "height": 0.38},
            "zone_id": null,
            "behavior": {
              "label": "CLEAR",
              "raw_label": "PASSING",
              "scores": {"CLEAR": 0.92, "EATING": 0.02, "DIGGING": 0.01, "UNKNOWN": 0.05},
              "model_id": "scripted-behavior-v1"
            },
            "region_evidence": {
              "approach_overlap": 0.0,
              "foliage_overlap": 0.0,
              "soil_overlap": 0.0,
              "motion_score": 0.25
            },
            "aim_preset_id": null,
            "no_fire_intersection": false
          }
        ]
      }
    }
  ],
  "expectations": {
    "explanation": "The second cat blocks the incident even though its own behavior is CLEAR and it is outside the approach zone.",
    "final_state": "MONITORING",
    "exact_counts": {
      "ready_transitions": 0,
      "would_burst_decisions": 0,
      "burst_commands_issued": 0,
      "burst_commands_acked": 0,
      "physical_bursts": 0,
      "automatic_retries": 0,
      "duplicate_commands_suppressed": 0,
      "fault_transitions": 0
    },
    "required_states": ["MONITORING"],
    "forbidden_states": ["AIMING", "READY", "BURST"],
    "required_reason_codes": ["MULTIPLE_CATS"],
    "forbidden_commands": ["GOTO_PRESET", "BURST"],
    "expected_action_sequence": [],
    "invariants": ["STARTS_DISARMED", "NO_PHYSICAL_EFFECTS", "MULTIPLE_CATS_BLOCK_ACTION", "ACTIONS_AUDITED", "DETERMINISTIC_REPLAY"]
  }
}
