{
  "schema_version": 1,
  "scenario_id": "person-interlock-v1",
  "title": "Person presence blocks a persistent eating event",
  "description": "A person is visible throughout otherwise action-worthy eating evidence. The person interlock is global for the frame and must prevent AIMING, READY, and BURST.",
  "requirement_ids": ["REQ-PERSON-BLOCKS-ACTION", "REQ-FAIL-CLOSED"],
  "tags": ["safety", "person", "interlock", "eating"],
  "config_ref": "../config/simulation-safe.example.json",
  "initial_conditions": {
    "clock_ms": 0,
    "policy_state": "DISARMED",
    "armed": false,
    "camera_status": "CONNECTED",
    "actuator_status": "READY",
    "command_id_seed": 1400
  },
  "actuator_script": {
    "default_response": "ACK",
    "ack_delay_ms": 20,
    "deduplicate_command_ids": true,
    "overrides": []
  },
  "timeline": [
    {"event_id": "arm", "at_ms": 0, "sequence": 0, "type": "CONTROL", "operation": "ARM"},
    {
      "event_id": "person-and-eating-series",
      "at_ms": 100,
      "sequence": 0,
      "type": "OBSERVATION_SERIES",
      "interval_ms": 400,
      "count": 5,
      "capture_offset_ms": 0,
      "id_prefix": "person-eating",
      "template": {
        "camera_id": "camera-1",
        "tracks": [
          {
            "track_id": "cat-a",
            "class": "CAT",
            "detection_confidence": 0.98,
            "track_quality": 0.96,
            "initial_track_age_ms": 900,
            "ambiguous": false,
            "bbox": {"x": 0.36, "y": 0.28, "width": 0.34, "height": 0.45},
            "zone_id": "pot-1-approach",
            "behavior": {
              "label": "EATING",
              "raw_label": "EATING",
              "scores": {"CLEAR": 0.02, "EATING": 0.94, "DIGGING": 0.01, "UNKNOWN": 0.03},
              "model_id": "scripted-behavior-v1"
            },
            "region_evidence": {
              "approach_overlap": 0.9,
              "foliage_overlap": 0.6,
              "soil_overlap": 0.05,
              "motion_score": 0.38
            },
            "aim_preset_id": "pot-1-safe-nearby",
            "no_fire_intersection": false
          },
          {
            "track_id": "person-a",
            "class": "PERSON",
            "detection_confidence": 0.93,
            "track_quality": 0.9,
            "initial_track_age_ms": 1000,
            "ambiguous": false,
            "bbox": {"x": 0.02, "y": 0.08, "width": 0.3, "height": 0.88}
          }
        ]
      }
    }
  ],
  "expectations": {
    "explanation": "Person presence is evaluated before behavior persistence and clears any confirmation accumulator for that observation.",
    "final_state": "MONITORING",
    "exact_counts": {
      "ready_transitions": 0,
      "would_burst_decisions": 0,
      "burst_commands_issued": 0,
      "burst_commands_acked": 0,
      "physical_bursts": 0,
      "automatic_retries": 0,
      "duplicate_commands_suppressed": 0,
      "fault_transitions": 0
    },
    "required_states": ["MONITORING"],
    "forbidden_states": ["AIMING", "READY", "BURST"],
    "required_reason_codes": ["PERSON_PRESENT"],
    "forbidden_commands": ["GOTO_PRESET", "BURST"],
    "expected_action_sequence": [],
    "invariants": ["STARTS_DISARMED", "NO_PHYSICAL_EFFECTS", "PERSON_BLOCKS_ACTION", "ACTIONS_AUDITED", "DETERMINISTIC_REPLAY"]
  }
}
