{
  "schema_version": 1,
  "scenario_id": "poor-track-v1",
  "title": "Poor track quality blocks confirmation",
  "description": "Eating evidence persists, but the track quality remains 0.45, below the configured 0.8 threshold. A strong classifier output must not compensate for unreliable association.",
  "requirement_ids": ["REQ-POOR-TRACK-HOLD", "REQ-EVIDENCE-QUALITY-GATE"],
  "tags": ["safety", "tracking", "poor-quality"],
  "config_ref": "../config/simulation-safe.example.json",
  "initial_conditions": {
    "clock_ms": 0,
    "policy_state": "DISARMED",
    "armed": false,
    "camera_status": "CONNECTED",
    "actuator_status": "READY",
    "command_id_seed": 1700
  },
  "actuator_script": {
    "default_response": "ACK",
    "ack_delay_ms": 20,
    "deduplicate_command_ids": true,
    "overrides": []
  },
  "timeline": [
    {"event_id": "arm", "at_ms": 0, "sequence": 0, "type": "CONTROL", "operation": "ARM"},
    {
      "event_id": "poor-track-series",
      "at_ms": 100,
      "sequence": 0,
      "type": "OBSERVATION_SERIES",
      "interval_ms": 400,
      "count": 5,
      "capture_offset_ms": 0,
      "id_prefix": "poor-track",
      "template": {
        "camera_id": "camera-1",
        "tracks": [
          {
            "track_id": "cat-unstable",
            "class": "CAT",
            "detection_confidence": 0.92,
            "track_quality": 0.45,
            "initial_track_age_ms": 1200,
            "ambiguous": false,
            "bbox": {"x": 0.36, "y": 0.28, "width": 0.34, "height": 0.44},
            "zone_id": "pot-1-approach",
            "behavior": {
              "label": "EATING",
              "raw_label": "EATING",
              "scores": {"CLEAR": 0.02, "EATING": 0.94, "DIGGING": 0.01, "UNKNOWN": 0.03},
              "model_id": "scripted-behavior-v1"
            },
            "region_evidence": {
              "approach_overlap": 0.9,
              "foliage_overlap": 0.61,
              "soil_overlap": 0.04,
              "motion_score": 0.4
            },
            "aim_preset_id": "pot-1-safe-nearby",
            "no_fire_intersection": false
          }
        ]
      }
    }
  ],
  "expectations": {
    "explanation": "The low-quality track is rejected before behavior persistence is accumulated.",
    "final_state": "MONITORING",
    "exact_counts": {
      "ready_transitions": 0,
      "would_burst_decisions": 0,
      "burst_commands_issued": 0,
      "burst_commands_acked": 0,
      "physical_bursts": 0,
      "automatic_retries": 0,
      "duplicate_commands_suppressed": 0,
      "fault_transitions": 0
    },
    "required_states": ["MONITORING"],
    "forbidden_states": ["CONFIRMING", "AIMING", "READY", "BURST"],
    "required_reason_codes": ["POOR_TRACK"],
    "forbidden_commands": ["GOTO_PRESET", "BURST"],
    "expected_action_sequence": [],
    "invariants": ["STARTS_DISARMED", "NO_PHYSICAL_EFFECTS", "POOR_TRACK_BLOCKS_ACTION", "ACTIONS_AUDITED", "DETERMINISTIC_REPLAY"]
  }
}
